name,dateOfBirth,biography
Buckie Falla,1976-06-29,"Cras mi pede, malesuada in, imperdiet et, commodo vulputate, justo. In blandit ultrices enim. Lorem ipsum dolor sit amet, consectetuer adipiscing elit."
Gracie Chave,1978-12-14,In hac habitasse platea dictumst. Etiam faucibus cursus urna. Ut tellus.
Russ Soans,1984-02-14,Maecenas ut massa quis augue luctus tincidunt. Nulla mollis molestie lorem.
Lancelot Andrini,1982-06-10,Pellentesque ultrices mattis odio.
Denise Mouan,1974-06-04,In sagittis dui vel nisl.
Salomi Alfonsetti,1997-07-25,"Integer pede justo, lacinia eget, tincidunt eget, tempus vel, pede. Morbi porttitor lorem id ligula. Suspendisse ornare consequat lectus."
Westleigh Penk,1987-01-01,Sed ante.
Gaylor Este,1977-10-08,Morbi non quam nec dui luctus rutrum. Nulla tellus.
Ogden Cheesley,1992-06-25,Etiam pretium iaculis justo.
Gran Bonnor,1997-12-24,Morbi non quam nec dui luctus rutrum.
Janice Bednall,1986-04-22,Nulla tellus.
Dar Blockley,1989-10-09,"Aliquam sit amet diam in magna bibendum imperdiet. Nullam orci pede, venenatis non, sodales sed, tincidunt eu, felis."
Martie Jaquet,1968-10-14,Pellentesque at nulla.
Cal Rounsefell,1963-08-06,Praesent blandit lacinia erat.
Feodor Flahy,1963-04-17,"Duis bibendum, felis sed interdum venenatis, turpis enim blandit mi, in porttitor pede justo eu massa. Donec dapibus."
Emalia Bingley,1994-01-18,Etiam pretium iaculis justo. In hac habitasse platea dictumst. Etiam faucibus cursus urna.
Liza Boraston,1990-12-24,Praesent id massa id nisl venenatis lacinia. Aenean sit amet justo.
Christian Nellies,1999-11-19,"Cras pellentesque volutpat dui. Maecenas tristique, est et tempus semper, est quam pharetra magna, ac consequat metus sapien ut nunc."
Sharl Mallinson,1972-08-28,"Vivamus vel nulla eget eros elementum pellentesque. Quisque porta volutpat erat. Quisque erat eros, viverra eget, congue eget, semper rutrum, nulla."
James Krebs,1963-07-29,"Nunc nisl. Duis bibendum, felis sed interdum venenatis, turpis enim blandit mi, in porttitor pede justo eu massa. Donec dapibus."
Benjamin Muldoon,1997-10-21,Nullam varius. Nulla facilisi. Cras non velit nec nisi vulputate nonummy.
Wallie O'Halleghane,1989-08-25,Vivamus tortor. Duis mattis egestas metus. Aenean fermentum.
Jo Flanne,1985-09-17,"Donec ut mauris eget massa tempor convallis. Nulla neque libero, convallis eget, eleifend luctus, ultricies eu, nibh. Quisque id justo sit amet sapien dignissim vestibulum."
Merv Fuente,1990-12-21,"Donec diam neque, vestibulum eget, vulputate ut, ultrices vel, augue. Vestibulum ante ipsum primis in faucibus orci luctus et ultrices posuere cubilia Curae; Donec pharetra, magna vestibulum aliquet ultrices, erat tortor sollicitudin mi, sit amet lobortis sapien sapien non mi. Integer ac neque."
Hodge Ireson,1999-09-25,Nulla mollis molestie lorem. Quisque ut erat. Curabitur gravida nisi at nibh.
Buckie Pallaske,1969-02-26,"Duis ac nibh. Fusce lacus purus, aliquet at, feugiat non, pretium quis, lectus."
Minna Kroll,1996-09-01,"Nam congue, risus semper porta volutpat, quam pede lobortis ligula, sit amet eleifend pede libero quis orci."
Cecilio Thebeaud,1971-10-25,Morbi a ipsum. Integer a nibh. In quis justo.
Bern Wackley,1968-11-14,Proin risus.
Saidee Balaizot,1966-01-15,Vestibulum ante ipsum primis in faucibus orci luctus et ultrices posuere cubilia Curae; Duis faucibus accumsan odio. Curabitur convallis. Duis consequat dui nec nisi volutpat eleifend.
Roddie Pinfold,1981-09-24,Vivamus in felis eu sapien cursus vestibulum.
Buck Cramer,1965-09-25,Vestibulum ante ipsum primis in faucibus orci luctus et ultrices posuere cubilia Curae; Mauris viverra diam vitae quam.
Archibold Hymas,1968-11-29,"Mauris enim leo, rhoncus sed, vestibulum sit amet, cursus id, turpis."
Mischa Capeling,1985-10-10,Nulla tempus.
Garrard Dosdell,1965-12-12,"Praesent lectus. Vestibulum quam sapien, varius ut, blandit non, interdum in, ante. Vestibulum ante ipsum primis in faucibus orci luctus et ultrices posuere cubilia Curae; Duis faucibus accumsan odio."
Richard Dionisii,1981-06-14,Proin risus. Praesent lectus.
Blaine Midson,1968-06-04,"Maecenas rhoncus aliquam lacus. Morbi quis tortor id nulla ultrices aliquet. Maecenas leo odio, condimentum id, luctus nec, molestie sed, justo."
Blair Tsar,1967-09-10,Praesent id massa id nisl venenatis lacinia. Aenean sit amet justo.
Whitman Riquet,1967-11-03,Quisque ut erat. Curabitur gravida nisi at nibh.
Wyatt Worswick,1994-07-31,Aenean auctor gravida sem.
Braden Pallaske,1996-12-05,Suspendisse potenti.
Tallou Esilmon,1977-09-25,"Duis ac nibh. Fusce lacus purus, aliquet at, feugiat non, pretium quis, lectus."
Kaye Fossitt,1969-06-24,"Maecenas tristique, est et tempus semper, est quam pharetra magna, ac consequat metus sapien ut nunc."
Ignatius Heliot,1996-02-22,Duis mattis egestas metus. Aenean fermentum. Donec ut mauris eget massa tempor convallis.
Cyndy Addionizio,1993-10-20,"In blandit ultrices enim. Lorem ipsum dolor sit amet, consectetuer adipiscing elit. Proin interdum mauris non ligula pellentesque ultrices."
Emmalynne Piser,1972-01-09,Nulla nisl. Nunc nisl.
Pippa Panas,1965-12-17,"Proin at turpis a pede posuere nonummy. Integer non velit. Donec diam neque, vestibulum eget, vulputate ut, ultrices vel, augue."
Gale Flindall,1965-03-23,Nullam sit amet turpis elementum ligula vehicula consequat.
Brittne Murden,1987-10-26,Aenean sit amet justo. Morbi ut odio.
Sloan Habble,1971-05-07,"Nam dui. Proin leo odio, porttitor id, consequat in, consequat ut, nulla."
Ginnifer Lorroway,1997-07-02,In sagittis dui vel nisl. Duis ac nibh.
Carole Dibdale,1968-07-30,"Vestibulum ac est lacinia nisi venenatis tristique. Fusce congue, diam id ornare imperdiet, sapien urna pretium nisl, ut volutpat sapien arcu sed augue. Aliquam erat volutpat."
Richmound Snawden,1983-03-26,In congue.
Fletch Teasdale,1992-12-27,Donec posuere metus vitae ipsum.
Pierrette Stobbe,1970-03-21,Etiam pretium iaculis justo.
Starlene Bernardi,1967-05-30,Nulla justo. Aliquam quis turpis eget elit sodales scelerisque.
Ogdon M'Quhan,1987-07-27,"In tempor, turpis nec euismod scelerisque, quam turpis adipiscing lorem, vitae mattis nibh ligula nec sem. Duis aliquam convallis nunc."
Jacintha Wheatman,1991-12-12,Nulla suscipit ligula in lacus.
Cybill Cundict,1976-04-25,"Aenean sit amet justo. Morbi ut odio. Cras mi pede, malesuada in, imperdiet et, commodo vulputate, justo."
Consuelo Dearl,1999-08-28,Morbi porttitor lorem id ligula. Suspendisse ornare consequat lectus.
Sebastiano Farnie,1969-08-05,Vivamus tortor.
Carmine Esland,1977-10-06,Praesent id massa id nisl venenatis lacinia. Aenean sit amet justo. Morbi ut odio.
Euphemia Spiteri,1994-05-06,In hac habitasse platea dictumst. Maecenas ut massa quis augue luctus tincidunt. Nulla mollis molestie lorem.
Celestyna Sandle,1980-11-06,Nulla tempus. Vivamus in felis eu sapien cursus vestibulum. Proin eu mi.
Annabell Oldham,1995-10-13,Aenean fermentum.
Aviva Scadding,1977-08-23,"Vestibulum quam sapien, varius ut, blandit non, interdum in, ante. Vestibulum ante ipsum primis in faucibus orci luctus et ultrices posuere cubilia Curae; Duis faucibus accumsan odio. Curabitur convallis."
Brandea Whotton,1971-01-30,"Vivamus metus arcu, adipiscing molestie, hendrerit at, vulputate vitae, nisl."
Eldredge Itzakovitz,1960-05-13,Maecenas ut massa quis augue luctus tincidunt.
Stephanus Lain,1981-12-04,In hac habitasse platea dictumst. Maecenas ut massa quis augue luctus tincidunt. Nulla mollis molestie lorem.
Judas Scatcher,1990-05-04,"Mauris ullamcorper purus sit amet nulla. Quisque arcu libero, rutrum ac, lobortis vel, dapibus at, diam."
Monte Wolledge,1981-06-18,"In blandit ultrices enim. Lorem ipsum dolor sit amet, consectetuer adipiscing elit."
Sidnee Firpi,1997-09-11,Aenean auctor gravida sem. Praesent id massa id nisl venenatis lacinia.
Rinaldo Wellstood,1961-12-24,In congue. Etiam justo.
Hussein Blackboro,1983-07-03,Aenean lectus. Pellentesque eget nunc.
Albina Mesant,1991-04-20,"In tempor, turpis nec euismod scelerisque, quam turpis adipiscing lorem, vitae mattis nibh ligula nec sem. Duis aliquam convallis nunc."
Clarine Heare,1980-01-06,"Lorem ipsum dolor sit amet, consectetuer adipiscing elit. Proin risus. Praesent lectus."
Adrienne Lightoller,1978-09-03,Integer ac neque. Duis bibendum. Morbi non quam nec dui luctus rutrum.
Tiphanie Battisson,1979-01-15,Aliquam non mauris. Morbi non lectus. Aliquam sit amet diam in magna bibendum imperdiet.
Dianna Dannohl,1997-07-06,Pellentesque at nulla. Suspendisse potenti. Cras in purus eu magna vulputate luctus.
Dasie Aicheson,1986-08-24,"In tempor, turpis nec euismod scelerisque, quam turpis adipiscing lorem, vitae mattis nibh ligula nec sem. Duis aliquam convallis nunc."
Happy Scranny,1998-05-17,Donec semper sapien a libero. Nam dui.
Lacey Chapelhow,1995-03-16,"Lorem ipsum dolor sit amet, consectetuer adipiscing elit."
Bertina Croad,1982-08-06,"Aliquam augue quam, sollicitudin vitae, consectetuer eget, rutrum at, lorem."
Katusha Hedger,1992-05-10,"Proin interdum mauris non ligula pellentesque ultrices. Phasellus id sapien in sapien iaculis congue. Vivamus metus arcu, adipiscing molestie, hendrerit at, vulputate vitae, nisl."
Corliss Hourston,1971-05-11,Proin eu mi. Nulla ac enim.
Aubrey Penquet,1963-06-17,Morbi vel lectus in quam fringilla rhoncus.
Deirdre Peacham,1991-06-01,Ut at dolor quis odio consequat varius. Integer ac leo. Pellentesque ultrices mattis odio.
Herculie Glasby,1966-03-21,In quis justo. Maecenas rhoncus aliquam lacus.
Ingmar Meldrum,1969-04-19,Vivamus vel nulla eget eros elementum pellentesque. Quisque porta volutpat erat.
Velvet Lumsdale,1963-09-22,Nulla facilisi. Cras non velit nec nisi vulputate nonummy. Maecenas tincidunt lacus at velit.
Orelia Scrinage,1972-03-17,"Donec vitae nisi. Nam ultrices, libero non mattis pulvinar, nulla pede ullamcorper augue, a suscipit nulla elit ac nulla. Sed vel enim sit amet nunc viverra dapibus."
Muffin Mulran,1996-10-19,"In hac habitasse platea dictumst. Aliquam augue quam, sollicitudin vitae, consectetuer eget, rutrum at, lorem."
Kaela Allanson,1988-02-09,Aenean lectus. Pellentesque eget nunc. Donec quis orci eget orci vehicula condimentum.
Yorker Coole,1991-04-25,"Nam congue, risus semper porta volutpat, quam pede lobortis ligula, sit amet eleifend pede libero quis orci. Nullam molestie nibh in lectus. Pellentesque at nulla."
Thurstan Mazonowicz,1974-07-09,"Praesent lectus. Vestibulum quam sapien, varius ut, blandit non, interdum in, ante. Vestibulum ante ipsum primis in faucibus orci luctus et ultrices posuere cubilia Curae; Duis faucibus accumsan odio."
Lilith Gages,1974-06-19,In eleifend quam a odio.
Iorgos Lamas,1994-06-16,Aenean auctor gravida sem.
Morgen Lambden,1969-10-31,"Phasellus id sapien in sapien iaculis congue. Vivamus metus arcu, adipiscing molestie, hendrerit at, vulputate vitae, nisl. Aenean lectus."
Judye Stones,1960-01-30,In hac habitasse platea dictumst. Maecenas ut massa quis augue luctus tincidunt. Nulla mollis molestie lorem.
Urbano Sowden,1980-05-08,Vivamus tortor. Duis mattis egestas metus. Aenean fermentum.
Rhoda Furzey,1981-11-24,Nulla justo. Aliquam quis turpis eget elit sodales scelerisque. Mauris sit amet eros.
Keane Gayne,1988-02-07,Maecenas ut massa quis augue luctus tincidunt. Nulla mollis molestie lorem. Quisque ut erat.
Gunar Hammelberg,1968-03-11,"In blandit ultrices enim. Lorem ipsum dolor sit amet, consectetuer adipiscing elit."
Lennard Jahndel,1992-10-28,Fusce consequat. Nulla nisl.
Cathie Bartalucci,1995-10-16,"In hac habitasse platea dictumst. Aliquam augue quam, sollicitudin vitae, consectetuer eget, rutrum at, lorem. Integer tincidunt ante vel ipsum."
Violante Pole,1979-04-17,"Duis bibendum, felis sed interdum venenatis, turpis enim blandit mi, in porttitor pede justo eu massa. Donec dapibus. Duis at velit eu est congue elementum."
Zerk Danneil,1975-02-25,"Fusce congue, diam id ornare imperdiet, sapien urna pretium nisl, ut volutpat sapien arcu sed augue."
Ivar Keneforde,1993-03-03,Ut tellus. Nulla ut erat id mauris vulputate elementum.
Benedetta Peteri,1971-04-06,"Integer aliquet, massa id lobortis convallis, tortor risus dapibus augue, vel accumsan tellus nisi eu orci. Mauris lacinia sapien quis libero. Nullam sit amet turpis elementum ligula vehicula consequat."
Robin Di Gregorio,1978-07-05,"Praesent lectus. Vestibulum quam sapien, varius ut, blandit non, interdum in, ante."
Seline Corcoran,1998-01-30,"Vestibulum ante ipsum primis in faucibus orci luctus et ultrices posuere cubilia Curae; Nulla dapibus dolor vel est. Donec odio justo, sollicitudin ut, suscipit a, feugiat et, eros. Vestibulum ac est lacinia nisi venenatis tristique."
Tiphani Weathers,1985-12-10,Morbi non quam nec dui luctus rutrum. Nulla tellus.
Lezley Streather,1973-09-02,Maecenas ut massa quis augue luctus tincidunt.
Bary Satterthwaite,1974-11-17,Cras non velit nec nisi vulputate nonummy. Maecenas tincidunt lacus at velit.
Emmey Tampling,1975-11-12,Curabitur gravida nisi at nibh.
Olimpia Bossel,1993-03-22,In hac habitasse platea dictumst. Etiam faucibus cursus urna.
Zarah Houndson,1989-07-10,Nullam porttitor lacus at turpis. Donec posuere metus vitae ipsum. Aliquam non mauris.
Charline Worters,1989-03-28,Maecenas rhoncus aliquam lacus. Morbi quis tortor id nulla ultrices aliquet.
Gustie Venour,1966-02-13,Maecenas pulvinar lobortis est. Phasellus sit amet erat.
Briana Aries,1972-03-09,Proin eu mi.
George Toon,1983-06-05,Phasellus id sapien in sapien iaculis congue.
Danyelle Dog,1980-12-01,Nulla tempus.
Wayland Crown,1967-03-21,Ut tellus. Nulla ut erat id mauris vulputate elementum. Nullam varius.
Nessie Putson,1997-03-17,"Nam congue, risus semper porta volutpat, quam pede lobortis ligula, sit amet eleifend pede libero quis orci."
Andreana Broggio,1976-04-23,Aenean lectus. Pellentesque eget nunc.
Lyn Atter,1988-06-18,Pellentesque at nulla. Suspendisse potenti.
Evelyn Hocking,1969-05-03,Vivamus tortor. Duis mattis egestas metus. Aenean fermentum.
Tristan De Domenici,1981-10-10,Aliquam non mauris. Morbi non lectus. Aliquam sit amet diam in magna bibendum imperdiet.
Andy Cowup,1996-04-29,"Morbi sem mauris, laoreet ut, rhoncus aliquet, pulvinar sed, nisl. Nunc rhoncus dui vel sem. Sed sagittis."
Kissiah Myall,1967-05-19,In quis justo.
Bobina Hayward,1973-08-16,"Maecenas tristique, est et tempus semper, est quam pharetra magna, ac consequat metus sapien ut nunc. Vestibulum ante ipsum primis in faucibus orci luctus et ultrices posuere cubilia Curae; Mauris viverra diam vitae quam."
Damara Shearman,1966-06-01,Phasellus sit amet erat.
Lisle Hedditch,1991-04-16,"Mauris enim leo, rhoncus sed, vestibulum sit amet, cursus id, turpis. Integer aliquet, massa id lobortis convallis, tortor risus dapibus augue, vel accumsan tellus nisi eu orci. Mauris lacinia sapien quis libero."
Colman Coupar,1977-06-22,"Maecenas leo odio, condimentum id, luctus nec, molestie sed, justo. Pellentesque viverra pede ac diam. Cras pellentesque volutpat dui."
Ashli Bloschke,1998-05-07,Vivamus in felis eu sapien cursus vestibulum. Proin eu mi. Nulla ac enim.
Peder Gregersen,1973-05-17,Nulla suscipit ligula in lacus. Curabitur at ipsum ac tellus semper interdum. Mauris ullamcorper purus sit amet nulla.
Alister Saxby,1996-03-31,Nulla justo. Aliquam quis turpis eget elit sodales scelerisque.
Marion Eskrigge,1997-05-26,"Lorem ipsum dolor sit amet, consectetuer adipiscing elit."
Arleen Caesman,1977-01-17,Vestibulum sed magna at nunc commodo placerat. Praesent blandit. Nam nulla.
Warner Eytel,1974-03-27,Curabitur gravida nisi at nibh. In hac habitasse platea dictumst.
Morse Blagden,1990-06-22,Donec posuere metus vitae ipsum.
Terrance Grinishin,1997-08-30,In quis justo. Maecenas rhoncus aliquam lacus. Morbi quis tortor id nulla ultrices aliquet.
Lindy Size,1999-09-02,Nulla tellus. In sagittis dui vel nisl.
Si Inge,1997-10-21,Nulla ut erat id mauris vulputate elementum.
Beck MacCracken,1990-08-14,Aliquam non mauris.
Kirsten Chugg,1980-08-25,"Donec odio justo, sollicitudin ut, suscipit a, feugiat et, eros."
Daniela Siddaley,1973-05-09,Aenean lectus.
Bendite Gulk,1987-02-01,"Vestibulum ac est lacinia nisi venenatis tristique. Fusce congue, diam id ornare imperdiet, sapien urna pretium nisl, ut volutpat sapien arcu sed augue. Aliquam erat volutpat."
Henrie Cammomile,1966-02-17,Sed ante.
Shalne Farlow,1968-05-04,Mauris lacinia sapien quis libero.
Roderich Ingre,1972-04-27,"Cras mi pede, malesuada in, imperdiet et, commodo vulputate, justo. In blandit ultrices enim."
Shelby Cocher,1966-03-19,Nullam sit amet turpis elementum ligula vehicula consequat. Morbi a ipsum. Integer a nibh.
Giuditta Esposita,1980-11-27,Proin eu mi.
Merrill Ingolotti,1972-04-13,Donec dapibus.
Cassandry Sollars,1988-02-24,"Integer pede justo, lacinia eget, tincidunt eget, tempus vel, pede. Morbi porttitor lorem id ligula."
Sarita Byart,1995-01-23,Morbi a ipsum. Integer a nibh. In quis justo.
Sigmund Pitone,1994-05-11,"In hac habitasse platea dictumst. Morbi vestibulum, velit id pretium iaculis, diam erat fermentum justo, nec condimentum neque sapien placerat ante. Nulla justo."
Kimmy Hazeley,1985-10-30,In hac habitasse platea dictumst.
Marlon Wetter,1968-01-27,Duis mattis egestas metus.
Riobard Willsmore,1986-10-03,"Cras in purus eu magna vulputate luctus. Cum sociis natoque penatibus et magnis dis parturient montes, nascetur ridiculus mus."
Lesly Garraway,1972-08-09,Fusce consequat. Nulla nisl. Nunc nisl.
Olenka Banville,1967-11-16,Aliquam non mauris. Morbi non lectus.
Skyler Castlake,1961-11-09,Donec dapibus.
Anstice Sleeny,1993-03-17,Donec semper sapien a libero. Nam dui.
Cris Blondell,1965-06-21,"Aenean sit amet justo. Morbi ut odio. Cras mi pede, malesuada in, imperdiet et, commodo vulputate, justo."
Winnifred Folk,1978-07-26,Donec dapibus.
Calley Corston,1988-03-28,Donec posuere metus vitae ipsum.
Lanna Olver,1976-12-23,Suspendisse accumsan tortor quis turpis. Sed ante.
Rodina Langlais,1988-05-10,Suspendisse potenti. In eleifend quam a odio. In hac habitasse platea dictumst.
Uta Dufaur,1983-09-26,Vestibulum sed magna at nunc commodo placerat. Praesent blandit. Nam nulla.
Jaclyn Reightley,1971-05-03,Morbi non lectus.
Sabrina Risely,1978-01-14,"Lorem ipsum dolor sit amet, consectetuer adipiscing elit."
Stella Briance,1997-12-27,"Mauris ullamcorper purus sit amet nulla. Quisque arcu libero, rutrum ac, lobortis vel, dapibus at, diam. Nam tristique tortor eu pede."
Dede Dunphy,1963-02-05,"In hac habitasse platea dictumst. Aliquam augue quam, sollicitudin vitae, consectetuer eget, rutrum at, lorem."
Silvester Shovelin,1976-10-12,"Lorem ipsum dolor sit amet, consectetuer adipiscing elit. Proin risus."
Amerigo Hilldrop,1970-10-12,Curabitur convallis.
Bertrando Cobbled,1997-11-28,Proin risus.
Burr Wallage,1996-12-04,"Integer aliquet, massa id lobortis convallis, tortor risus dapibus augue, vel accumsan tellus nisi eu orci. Mauris lacinia sapien quis libero."
Sancho Plinck,1960-10-20,In hac habitasse platea dictumst. Etiam faucibus cursus urna.
Robb Sanham,1973-01-21,Suspendisse potenti. Cras in purus eu magna vulputate luctus.
Mar de Keyser,1977-09-30,Pellentesque eget nunc. Donec quis orci eget orci vehicula condimentum. Curabitur in libero ut massa volutpat convallis.
Mauricio Seymark,1993-11-04,"Vestibulum ante ipsum primis in faucibus orci luctus et ultrices posuere cubilia Curae; Nulla dapibus dolor vel est. Donec odio justo, sollicitudin ut, suscipit a, feugiat et, eros."
Parnell Coale,1983-09-14,Cras non velit nec nisi vulputate nonummy. Maecenas tincidunt lacus at velit. Vivamus vel nulla eget eros elementum pellentesque.
Carole McCluney,1999-04-21,Aenean sit amet justo.
Melisent Itskovitz,1983-08-05,"Lorem ipsum dolor sit amet, consectetuer adipiscing elit. Proin interdum mauris non ligula pellentesque ultrices."
Stefano Simner,1982-09-30,"In tempor, turpis nec euismod scelerisque, quam turpis adipiscing lorem, vitae mattis nibh ligula nec sem. Duis aliquam convallis nunc."
Nicholle Mc Dermid,1998-11-05,Sed sagittis.
Putnem Osbourn,1991-04-10,In sagittis dui vel nisl. Duis ac nibh.
Emmalynne Shadfourth,1970-07-06,Curabitur in libero ut massa volutpat convallis.
Minda Andrey,1992-01-11,Nulla justo.
Jesus Randalston,1992-03-23,"Vivamus metus arcu, adipiscing molestie, hendrerit at, vulputate vitae, nisl. Aenean lectus."
Sauncho Taffs,1960-11-25,"Nam ultrices, libero non mattis pulvinar, nulla pede ullamcorper augue, a suscipit nulla elit ac nulla."
Suzy Rigolle,1985-07-12,Donec posuere metus vitae ipsum. Aliquam non mauris.
Halie Temlett,1997-01-08,Aliquam non mauris.
Gunar Phippen,1979-03-03,Vestibulum ac est lacinia nisi venenatis tristique.
Kaile Bispham,1992-06-30,In congue.
Malvina Caplan,1962-12-06,"Morbi quis tortor id nulla ultrices aliquet. Maecenas leo odio, condimentum id, luctus nec, molestie sed, justo. Pellentesque viverra pede ac diam."
Baudoin Lammertz,1988-07-23,Nulla justo.
Tiffany Dickman,1989-06-17,Sed ante.
Prudence Kiebes,1964-09-04,"Morbi vel lectus in quam fringilla rhoncus. Mauris enim leo, rhoncus sed, vestibulum sit amet, cursus id, turpis. Integer aliquet, massa id lobortis convallis, tortor risus dapibus augue, vel accumsan tellus nisi eu orci."
Cyndy Clout,1994-01-06,Integer tincidunt ante vel ipsum. Praesent blandit lacinia erat.
Thorin Hidderley,1982-01-16,Proin at turpis a pede posuere nonummy. Integer non velit.
Barbabra Mayne,1990-03-27,Proin at turpis a pede posuere nonummy.
Pansy de Werk,1982-07-21,"Cum sociis natoque penatibus et magnis dis parturient montes, nascetur ridiculus mus. Vivamus vestibulum sagittis sapien. Cum sociis natoque penatibus et magnis dis parturient montes, nascetur ridiculus mus."
Maury Cisland,1965-03-01,Donec ut dolor. Morbi vel lectus in quam fringilla rhoncus.
Webb Cornish,1991-03-28,"Aenean fermentum. Donec ut mauris eget massa tempor convallis. Nulla neque libero, convallis eget, eleifend luctus, ultricies eu, nibh."
Barron Deakan,1983-05-01,"In hac habitasse platea dictumst. Aliquam augue quam, sollicitudin vitae, consectetuer eget, rutrum at, lorem."
Sal Dudding,1994-08-19,"Cras mi pede, malesuada in, imperdiet et, commodo vulputate, justo."
Carver Gatty,1967-09-03,Phasellus sit amet erat.
Adriana Hazell,1993-09-21,In eleifend quam a odio.
Cobby Clamp,1969-03-05,Donec semper sapien a libero. Nam dui.
Bard Ellams,1961-06-17,Maecenas ut massa quis augue luctus tincidunt. Nulla mollis molestie lorem. Quisque ut erat.
Muffin Charge,1996-04-17,Maecenas pulvinar lobortis est. Phasellus sit amet erat. Nulla tempus.
Cam Drennan,1992-05-18,Aliquam non mauris.
Hasheem Sherington,1973-06-19,Suspendisse accumsan tortor quis turpis. Sed ante.
Galven Iacomini,1979-03-23,"Pellentesque ultrices mattis odio. Donec vitae nisi. Nam ultrices, libero non mattis pulvinar, nulla pede ullamcorper augue, a suscipit nulla elit ac nulla."
Jeremias O'Luby,1983-03-30,Vivamus vel nulla eget eros elementum pellentesque.
Griffy Vanyukov,1982-05-03,"Vivamus metus arcu, adipiscing molestie, hendrerit at, vulputate vitae, nisl. Aenean lectus."
Jamill Haddon,1994-05-18,Nullam molestie nibh in lectus.
Hyacinth Cornfield,1962-02-24,"Integer non velit. Donec diam neque, vestibulum eget, vulputate ut, ultrices vel, augue. Vestibulum ante ipsum primis in faucibus orci luctus et ultrices posuere cubilia Curae; Donec pharetra, magna vestibulum aliquet ultrices, erat tortor sollicitudin mi, sit amet lobortis sapien sapien non mi."
Chaddy Hugnet,1995-01-02,Quisque ut erat.
Tova Deuss,1967-03-03,Mauris lacinia sapien quis libero. Nullam sit amet turpis elementum ligula vehicula consequat.
Waverly Plant,1997-05-05,Suspendisse ornare consequat lectus.
Jarrod Anfusso,1975-05-26,Ut tellus. Nulla ut erat id mauris vulputate elementum.
Charlot Manifield,1972-10-22,Duis mattis egestas metus. Aenean fermentum.
Gertrudis Kitchenman,1968-08-09,"Morbi quis tortor id nulla ultrices aliquet. Maecenas leo odio, condimentum id, luctus nec, molestie sed, justo. Pellentesque viverra pede ac diam."
Ryun McIlenna,1985-10-05,Vestibulum ante ipsum primis in faucibus orci luctus et ultrices posuere cubilia Curae; Mauris viverra diam vitae quam. Suspendisse potenti. Nullam porttitor lacus at turpis.
Berk Gullick,1985-08-30,Donec posuere metus vitae ipsum. Aliquam non mauris. Morbi non lectus.
Theda Ethelstone,1991-07-29,Curabitur gravida nisi at nibh. In hac habitasse platea dictumst.
Kelly Benger,1983-11-11,Quisque ut erat.
Kay Woolager,1984-01-29,"Donec diam neque, vestibulum eget, vulputate ut, ultrices vel, augue. Vestibulum ante ipsum primis in faucibus orci luctus et ultrices posuere cubilia Curae; Donec pharetra, magna vestibulum aliquet ultrices, erat tortor sollicitudin mi, sit amet lobortis sapien sapien non mi."
Waly Elsie,1962-10-18,Quisque ut erat. Curabitur gravida nisi at nibh. In hac habitasse platea dictumst.
Quintin Mayell,1996-08-27,Praesent id massa id nisl venenatis lacinia. Aenean sit amet justo.
Gae Aucoate,1979-08-19,Donec posuere metus vitae ipsum.
Thornton Etchingham,1973-06-29,Nulla justo. Aliquam quis turpis eget elit sodales scelerisque.
Piggy Tattam,1991-08-30,"Praesent blandit. Nam nulla. Integer pede justo, lacinia eget, tincidunt eget, tempus vel, pede."
Minny Rymill,1978-12-29,"Lorem ipsum dolor sit amet, consectetuer adipiscing elit."
Noreen Allgood,1997-05-26,"Morbi non lectus. Aliquam sit amet diam in magna bibendum imperdiet. Nullam orci pede, venenatis non, sodales sed, tincidunt eu, felis."
Graig Roundtree,1963-02-17,"Morbi vestibulum, velit id pretium iaculis, diam erat fermentum justo, nec condimentum neque sapien placerat ante. Nulla justo. Aliquam quis turpis eget elit sodales scelerisque."
Kata Di Pietro,1994-08-11,In congue.
Humfrid Stallan,1976-03-09,Aenean lectus. Pellentesque eget nunc.
Katlin Hoy,1979-06-10,"Integer non velit. Donec diam neque, vestibulum eget, vulputate ut, ultrices vel, augue."
Heidi McKew,1964-02-21,"Curabitur in libero ut massa volutpat convallis. Morbi odio odio, elementum eu, interdum eu, tincidunt in, leo."
