name,dateOfBirth,biography
Lorenza Ivell,1969-02-09,In eleifend quam a odio. In hac habitasse platea dictumst.
Willetta Lackemann,1969-11-10,Proin at turpis a pede posuere nonummy.
Joana Sanchis,1983-09-19,Duis mattis egestas metus.
Brandie Piken,1977-10-20,"Cum sociis natoque penatibus et magnis dis parturient montes, nascetur ridiculus mus."
Vernen Gownge,1983-08-08,Praesent lectus.
Carrissa Tappor,1998-05-04,Mauris lacinia sapien quis libero. Nullam sit amet turpis elementum ligula vehicula consequat.
Bibi Colisbe,1972-11-23,Duis at velit eu est congue elementum. In hac habitasse platea dictumst.
Witty Speachley,1960-01-05,Sed ante.
Ingar Filipczak,1971-08-17,Pellentesque at nulla.
Tabina Fairbrace,1967-12-13,"Donec ut mauris eget massa tempor convallis. Nulla neque libero, convallis eget, eleifend luctus, ultricies eu, nibh."
Sile Ferebee,1974-10-10,Praesent blandit.
Sydelle Alessandretti,1995-11-11,"Maecenas tristique, est et tempus semper, est quam pharetra magna, ac consequat metus sapien ut nunc. Vestibulum ante ipsum primis in faucibus orci luctus et ultrices posuere cubilia Curae; Mauris viverra diam vitae quam. Suspendisse potenti."
Zebulen Tournay,1986-09-30,"Morbi vestibulum, velit id pretium iaculis, diam erat fermentum justo, nec condimentum neque sapien placerat ante."
Michal Drescher,1994-02-15,"Donec ut dolor. Morbi vel lectus in quam fringilla rhoncus. Mauris enim leo, rhoncus sed, vestibulum sit amet, cursus id, turpis."
Eudora Bickle,1995-03-17,Cras non velit nec nisi vulputate nonummy. Maecenas tincidunt lacus at velit. Vivamus vel nulla eget eros elementum pellentesque.
Nicol Hounsham,1962-02-27,Morbi quis tortor id nulla ultrices aliquet.
Lavina Brozek,1992-08-11,Vestibulum ante ipsum primis in faucibus orci luctus et ultrices posuere cubilia Curae; Duis faucibus accumsan odio.
Abrahan Matton,1980-12-04,Duis bibendum. Morbi non quam nec dui luctus rutrum. Nulla tellus.
Man McCullouch,1965-12-20,Morbi a ipsum. Integer a nibh. In quis justo.
Pyotr Kornacki,1998-07-13,Aliquam quis turpis eget elit sodales scelerisque. Mauris sit amet eros.
Sarah Cosgriff,1983-01-04,Praesent blandit lacinia erat.
Basil Tulleth,1970-07-26,Nulla ut erat id mauris vulputate elementum. Nullam varius.
Emmery Coyne,1972-05-06,"Proin leo odio, porttitor id, consequat in, consequat ut, nulla."
Bayard Wigley,1973-02-14,Sed vel enim sit amet nunc viverra dapibus. Nulla suscipit ligula in lacus.
Eziechiele Chasemoore,1989-07-21,"Suspendisse ornare consequat lectus. In est risus, auctor sed, tristique in, tempus sit amet, sem."
Husain Johansson,1973-09-09,Integer ac neque.
Judon Kroll,1974-10-24,Etiam justo. Etiam pretium iaculis justo.
Rod Warner,1981-07-18,Pellentesque eget nunc.
Cassondra Kilner,1968-11-18,"Morbi quis tortor id nulla ultrices aliquet. Maecenas leo odio, condimentum id, luctus nec, molestie sed, justo."
Mindy Mallatratt,1997-12-10,"In sagittis dui vel nisl. Duis ac nibh. Fusce lacus purus, aliquet at, feugiat non, pretium quis, lectus."
Ryan Twelves,1981-11-12,Aliquam sit amet diam in magna bibendum imperdiet.
Edgard Brucker,1974-06-02,Vestibulum sed magna at nunc commodo placerat. Praesent blandit.
Herculie Adamovitch,1974-01-01,Vestibulum ante ipsum primis in faucibus orci luctus et ultrices posuere cubilia Curae; Duis faucibus accumsan odio.
Broddy Ouver,1971-04-05,Vivamus vel nulla eget eros elementum pellentesque. Quisque porta volutpat erat.
Brannon Leblanc,1968-03-20,Nunc purus. Phasellus in felis. Donec semper sapien a libero.
Tilda Reschke,1994-06-03,Praesent lectus.
Shanie Parres,1976-12-26,Pellentesque ultrices mattis odio.
Cirillo Armand,1997-03-24,"Quisque erat eros, viverra eget, congue eget, semper rutrum, nulla."
Amory Artois,1973-03-25,Integer a nibh. In quis justo.
Ulrika Zottoli,1976-07-24,Sed vel enim sit amet nunc viverra dapibus.
Daloris Vynehall,1962-06-30,"Nullam orci pede, venenatis non, sodales sed, tincidunt eu, felis. Fusce posuere felis sed lacus. Morbi sem mauris, laoreet ut, rhoncus aliquet, pulvinar sed, nisl."
Fayette Grewer,1986-03-01,Nulla ut erat id mauris vulputate elementum.
Bonni Dantesia,1961-01-28,"Curabitur in libero ut massa volutpat convallis. Morbi odio odio, elementum eu, interdum eu, tincidunt in, leo. Maecenas pulvinar lobortis est."
Gerry Alred,1986-03-28,Nullam sit amet turpis elementum ligula vehicula consequat.
Lorne O'Shaughnessy,1970-12-15,Aliquam erat volutpat. In congue.
Kaia Matskiv,1966-08-24,Vestibulum ac est lacinia nisi venenatis tristique.
Marshall Mackilpatrick,1963-04-14,"Nulla neque libero, convallis eget, eleifend luctus, ultricies eu, nibh. Quisque id justo sit amet sapien dignissim vestibulum. Vestibulum ante ipsum primis in faucibus orci luctus et ultrices posuere cubilia Curae; Nulla dapibus dolor vel est."
Jammie Bebbington,1984-07-31,Donec ut mauris eget massa tempor convallis.
Joycelin Percifer,1970-04-30,"Lorem ipsum dolor sit amet, consectetuer adipiscing elit. Proin risus."
Leland Stealfox,1982-02-06,"Aliquam sit amet diam in magna bibendum imperdiet. Nullam orci pede, venenatis non, sodales sed, tincidunt eu, felis."
Marilyn Lashford,1961-05-09,Proin interdum mauris non ligula pellentesque ultrices. Phasellus id sapien in sapien iaculis congue.
Star Worviell,1989-03-19,"Integer pede justo, lacinia eget, tincidunt eget, tempus vel, pede."
Lindy Flatte,1998-06-17,"Nam nulla. Integer pede justo, lacinia eget, tincidunt eget, tempus vel, pede."
Melicent Davidwitz,1971-07-13,"Donec vitae nisi. Nam ultrices, libero non mattis pulvinar, nulla pede ullamcorper augue, a suscipit nulla elit ac nulla. Sed vel enim sit amet nunc viverra dapibus."
Joella Millthorpe,1986-10-23,"Maecenas leo odio, condimentum id, luctus nec, molestie sed, justo. Pellentesque viverra pede ac diam."
Henry Blitz,1970-03-11,"Morbi odio odio, elementum eu, interdum eu, tincidunt in, leo."
Silas O'Moylan,1965-11-02,Suspendisse potenti.
Bradan Segrott,1973-12-02,In hac habitasse platea dictumst.
Wald Ricardet,1989-09-06,"Morbi ut odio. Cras mi pede, malesuada in, imperdiet et, commodo vulputate, justo. In blandit ultrices enim."
Jessalyn Gibbings,1982-12-07,"Integer pede justo, lacinia eget, tincidunt eget, tempus vel, pede. Morbi porttitor lorem id ligula."
Tomas Bruinsma,1974-06-03,"Proin risus. Praesent lectus. Vestibulum quam sapien, varius ut, blandit non, interdum in, ante."
Jorge Longworthy,1964-11-30,Praesent id massa id nisl venenatis lacinia. Aenean sit amet justo. Morbi ut odio.
Kaila Cadreman,1989-01-20,"Vivamus vestibulum sagittis sapien. Cum sociis natoque penatibus et magnis dis parturient montes, nascetur ridiculus mus. Etiam vel augue."
Wolfie Figgen,1994-07-02,"Cum sociis natoque penatibus et magnis dis parturient montes, nascetur ridiculus mus."
Wallace Valens-Smith,1967-11-25,Pellentesque at nulla.
Rene Philbrook,1997-06-01,Praesent id massa id nisl venenatis lacinia. Aenean sit amet justo.
Tabby Desbrow,1960-06-06,Maecenas pulvinar lobortis est. Phasellus sit amet erat. Nulla tempus.
Florencia Roches,1968-07-17,"Proin interdum mauris non ligula pellentesque ultrices. Phasellus id sapien in sapien iaculis congue. Vivamus metus arcu, adipiscing molestie, hendrerit at, vulputate vitae, nisl."
Cecile Beckensall,1965-10-19,"Morbi vel lectus in quam fringilla rhoncus. Mauris enim leo, rhoncus sed, vestibulum sit amet, cursus id, turpis. Integer aliquet, massa id lobortis convallis, tortor risus dapibus augue, vel accumsan tellus nisi eu orci."
Sue Cheal,1989-01-20,Integer non velit.
Carey Sayers,1995-07-30,In quis justo. Maecenas rhoncus aliquam lacus.
Carmon Steinhammer,1977-03-20,"Maecenas rhoncus aliquam lacus. Morbi quis tortor id nulla ultrices aliquet. Maecenas leo odio, condimentum id, luctus nec, molestie sed, justo."
Maddie Mackelworth,1960-07-19,Nullam porttitor lacus at turpis. Donec posuere metus vitae ipsum. Aliquam non mauris.
Valentijn Deniset,1992-03-01,"Morbi ut odio. Cras mi pede, malesuada in, imperdiet et, commodo vulputate, justo."
Zabrina Bastock,1970-04-21,"Phasellus id sapien in sapien iaculis congue. Vivamus metus arcu, adipiscing molestie, hendrerit at, vulputate vitae, nisl."
Sile Dimitru,1978-08-02,Aliquam sit amet diam in magna bibendum imperdiet.
Clio Rayburn,1966-06-01,"Quisque erat eros, viverra eget, congue eget, semper rutrum, nulla."
Randie Bote,1968-06-18,"Morbi quis tortor id nulla ultrices aliquet. Maecenas leo odio, condimentum id, luctus nec, molestie sed, justo. Pellentesque viverra pede ac diam."
Alfie Boomes,1984-09-09,Aenean auctor gravida sem. Praesent id massa id nisl venenatis lacinia. Aenean sit amet justo.
Hazel Wheelan,1988-12-30,"Cras mi pede, malesuada in, imperdiet et, commodo vulputate, justo."
Crystal Jery,1967-06-15,"Quisque id justo sit amet sapien dignissim vestibulum. Vestibulum ante ipsum primis in faucibus orci luctus et ultrices posuere cubilia Curae; Nulla dapibus dolor vel est. Donec odio justo, sollicitudin ut, suscipit a, feugiat et, eros."
Tamera Hatherall,1965-05-27,"Phasellus id sapien in sapien iaculis congue. Vivamus metus arcu, adipiscing molestie, hendrerit at, vulputate vitae, nisl."
Floyd Kynder,1967-01-31,"Lorem ipsum dolor sit amet, consectetuer adipiscing elit. Proin risus."
Anabella Kennally,1997-05-29,"Quisque id justo sit amet sapien dignissim vestibulum. Vestibulum ante ipsum primis in faucibus orci luctus et ultrices posuere cubilia Curae; Nulla dapibus dolor vel est. Donec odio justo, sollicitudin ut, suscipit a, feugiat et, eros."
Prudy Gellately,1997-11-27,Donec ut dolor.
Aylmar Vasyukhichev,1987-03-24,"Duis bibendum, felis sed interdum venenatis, turpis enim blandit mi, in porttitor pede justo eu massa."
Kyla Hought,1986-10-12,Morbi a ipsum.
Gwen Belle,1997-04-14,"Cras in purus eu magna vulputate luctus. Cum sociis natoque penatibus et magnis dis parturient montes, nascetur ridiculus mus."
Northrup Figures,1983-12-31,Maecenas ut massa quis augue luctus tincidunt. Nulla mollis molestie lorem.
Valentine Brastead,1996-09-13,Praesent blandit lacinia erat. Vestibulum sed magna at nunc commodo placerat.
Lynelle Jakes,1995-03-07,"Nulla neque libero, convallis eget, eleifend luctus, ultricies eu, nibh. Quisque id justo sit amet sapien dignissim vestibulum."
Britni Cuerda,1993-03-02,Maecenas tincidunt lacus at velit. Vivamus vel nulla eget eros elementum pellentesque.
Tobi Branford,1997-10-12,"Duis ac nibh. Fusce lacus purus, aliquet at, feugiat non, pretium quis, lectus."
Carce Tilbrook,1992-10-26,"Proin at turpis a pede posuere nonummy. Integer non velit. Donec diam neque, vestibulum eget, vulputate ut, ultrices vel, augue."
Jude Bernadon,1966-08-05,"Fusce congue, diam id ornare imperdiet, sapien urna pretium nisl, ut volutpat sapien arcu sed augue. Aliquam erat volutpat. In congue."
Meade Kenset,1973-03-07,Integer ac neque.
Corilla Dracey,1998-01-19,Quisque ut erat. Curabitur gravida nisi at nibh. In hac habitasse platea dictumst.
Winnie Piddlesden,1995-04-29,Proin at turpis a pede posuere nonummy. Integer non velit.
Melisa Southern,1995-01-31,Nulla facilisi. Cras non velit nec nisi vulputate nonummy.
Simona Oxbury,1979-05-26,Nulla mollis molestie lorem. Quisque ut erat. Curabitur gravida nisi at nibh.
Godwin Jereatt,1971-07-15,Praesent blandit lacinia erat. Vestibulum sed magna at nunc commodo placerat.
Morly McSherry,1962-06-06,"Morbi odio odio, elementum eu, interdum eu, tincidunt in, leo. Maecenas pulvinar lobortis est."
Christoph Cosely,1990-06-23,"Morbi quis tortor id nulla ultrices aliquet. Maecenas leo odio, condimentum id, luctus nec, molestie sed, justo. Pellentesque viverra pede ac diam."
Winna Gunnell,1973-04-07,In hac habitasse platea dictumst.
Florenza McGrae,1961-03-31,"Suspendisse potenti. Cras in purus eu magna vulputate luctus. Cum sociis natoque penatibus et magnis dis parturient montes, nascetur ridiculus mus."
Yuri Wakelam,1989-08-01,"Vivamus vestibulum sagittis sapien. Cum sociis natoque penatibus et magnis dis parturient montes, nascetur ridiculus mus. Etiam vel augue."
Ozzie Bucklee,1986-06-26,Nulla mollis molestie lorem. Quisque ut erat. Curabitur gravida nisi at nibh.
Cynthia Blance,1969-10-26,Morbi a ipsum.
Doris Knoble,1989-02-24,"Lorem ipsum dolor sit amet, consectetuer adipiscing elit. Proin risus."
Arlan Sporton,1971-06-23,Phasellus sit amet erat. Nulla tempus. Vivamus in felis eu sapien cursus vestibulum.
Huntington Plume,1990-09-23,"Morbi odio odio, elementum eu, interdum eu, tincidunt in, leo. Maecenas pulvinar lobortis est."
Henka Bransom,1991-04-20,Ut tellus. Nulla ut erat id mauris vulputate elementum.
Stu Abbet,1982-06-10,Duis bibendum. Morbi non quam nec dui luctus rutrum.
Obidiah Shillabear,1986-12-11,Proin eu mi. Nulla ac enim.
Darcy Malster,1988-11-15,"Maecenas leo odio, condimentum id, luctus nec, molestie sed, justo. Pellentesque viverra pede ac diam. Cras pellentesque volutpat dui."
Noach Mayers,1960-10-31,"In blandit ultrices enim. Lorem ipsum dolor sit amet, consectetuer adipiscing elit."
Kaile Rotte,1963-12-11,Vestibulum ante ipsum primis in faucibus orci luctus et ultrices posuere cubilia Curae; Mauris viverra diam vitae quam.
Dorisa Baynard,1990-06-18,"Morbi vestibulum, velit id pretium iaculis, diam erat fermentum justo, nec condimentum neque sapien placerat ante. Nulla justo."
Benedicta Chopy,1985-06-23,Sed ante.
Tyrus Lockner,1979-11-15,"Nam ultrices, libero non mattis pulvinar, nulla pede ullamcorper augue, a suscipit nulla elit ac nulla."
Tobias Mungan,1999-03-09,Nulla mollis molestie lorem. Quisque ut erat. Curabitur gravida nisi at nibh.
Lenci Kleehuhler,1996-04-30,Vestibulum ante ipsum primis in faucibus orci luctus et ultrices posuere cubilia Curae; Mauris viverra diam vitae quam.
Chester Piel,1991-09-18,Vivamus tortor. Duis mattis egestas metus.
Tim Laverock,1965-07-27,Vestibulum sed magna at nunc commodo placerat. Praesent blandit. Nam nulla.
Shoshana Borthe,1990-11-06,Duis consequat dui nec nisi volutpat eleifend. Donec ut dolor.
Marie Watmough,1980-11-13,Morbi porttitor lorem id ligula. Suspendisse ornare consequat lectus.
Marilee Longhorne,1981-07-02,Curabitur in libero ut massa volutpat convallis.
Kass Higbin,1961-12-05,Donec posuere metus vitae ipsum. Aliquam non mauris. Morbi non lectus.
Frants Oen,1999-02-27,Aenean fermentum. Donec ut mauris eget massa tempor convallis.
Taite Leibold,1997-09-28,"Aliquam sit amet diam in magna bibendum imperdiet. Nullam orci pede, venenatis non, sodales sed, tincidunt eu, felis. Fusce posuere felis sed lacus."
Fred Hutcheons,1962-05-12,"Quisque arcu libero, rutrum ac, lobortis vel, dapibus at, diam. Nam tristique tortor eu pede."
Rockey Bucher,1976-01-01,Ut at dolor quis odio consequat varius.
Ryon Haddon,1998-01-29,In hac habitasse platea dictumst. Maecenas ut massa quis augue luctus tincidunt. Nulla mollis molestie lorem.
Felecia Carbine,1998-05-13,Duis bibendum. Morbi non quam nec dui luctus rutrum.
Augustin Aleksankin,1994-11-13,"Proin leo odio, porttitor id, consequat in, consequat ut, nulla. Sed accumsan felis. Ut at dolor quis odio consequat varius."
Inglis Barrand,1970-04-15,"Maecenas tristique, est et tempus semper, est quam pharetra magna, ac consequat metus sapien ut nunc."
Alic Hagston,1991-01-24,"Vivamus vel nulla eget eros elementum pellentesque. Quisque porta volutpat erat. Quisque erat eros, viverra eget, congue eget, semper rutrum, nulla."
Dacey Edgington,1979-01-18,Nulla ut erat id mauris vulputate elementum. Nullam varius.
Neal Winters,1975-10-31,Duis aliquam convallis nunc. Proin at turpis a pede posuere nonummy. Integer non velit.
Westley Wheatman,1969-07-07,Nulla tempus.
Graig Akerman,1982-04-15,Nulla justo. Aliquam quis turpis eget elit sodales scelerisque.
Rasia Garrique,1967-03-14,"Duis bibendum, felis sed interdum venenatis, turpis enim blandit mi, in porttitor pede justo eu massa. Donec dapibus."
Magnum Houldcroft,1981-04-25,"Cras in purus eu magna vulputate luctus. Cum sociis natoque penatibus et magnis dis parturient montes, nascetur ridiculus mus."
Hertha Shills,1996-11-06,"Lorem ipsum dolor sit amet, consectetuer adipiscing elit. Proin interdum mauris non ligula pellentesque ultrices."
Jodee Stanbro,1964-01-23,Integer tincidunt ante vel ipsum. Praesent blandit lacinia erat. Vestibulum sed magna at nunc commodo placerat.
Kendal Whaites,1968-11-21,"Quisque id justo sit amet sapien dignissim vestibulum. Vestibulum ante ipsum primis in faucibus orci luctus et ultrices posuere cubilia Curae; Nulla dapibus dolor vel est. Donec odio justo, sollicitudin ut, suscipit a, feugiat et, eros."
Emelita Oriel,1976-03-24,Morbi porttitor lorem id ligula.
Bink Elphey,1961-03-07,Fusce consequat. Nulla nisl. Nunc nisl.
Harman Longhorne,1970-12-28,Aenean sit amet justo.
Davin Gallie,1970-04-12,Phasellus in felis.
Gay Roskell,1989-08-01,Morbi vel lectus in quam fringilla rhoncus.
Gertrude Rawll,1974-08-08,"In hac habitasse platea dictumst. Aliquam augue quam, sollicitudin vitae, consectetuer eget, rutrum at, lorem. Integer tincidunt ante vel ipsum."
Viole Tapping,1979-08-17,Ut tellus.
Terry Webber,1969-12-29,Aliquam erat volutpat. In congue. Etiam justo.
Delphine Paxforde,1968-06-15,Sed vel enim sit amet nunc viverra dapibus. Nulla suscipit ligula in lacus. Curabitur at ipsum ac tellus semper interdum.
Miles Dewane,1971-11-29,"Aenean fermentum. Donec ut mauris eget massa tempor convallis. Nulla neque libero, convallis eget, eleifend luctus, ultricies eu, nibh."
Rodger Revening,1976-01-24,"Phasellus id sapien in sapien iaculis congue. Vivamus metus arcu, adipiscing molestie, hendrerit at, vulputate vitae, nisl."
